TEXT,ID,Human codes,gpt-3.5-turbo,Claude 2,llama13b-v2-chat,llama7b-v2-chat,Relational Uncertainty
There are many things that are certain in my relationship. One of the main things that I'm certain about is the bond we have with each other. I believe the bond we have is unbreakable. We've known each other from the ages of 12 and 14. Another thing I'm certain about is that we're getting married June 2019. We both waited a long time for that day and it'll be here soon. Although my relationship is perfect there is one thing that I'm uncertain about. I'm uncertain about 20 years from now is her feelings going to change? She hasn't really been with anyone throughout her life and I wonder would she go through a phase where she just wants to try something new since she's been with me for so long. I read stories like that all the time from women who have been with their significant others for a long time and just think the grass is greener on the other side. Although I feel that my relationship is perfect there is one thing that I'm uncertain about. Experiences a divorce is something that I would not want to go through. From the financial outcomes to the emotional ones.,3,5.5,3,4,5,6,6
"One of the things i am certain about in our relationship is how much we love each other. I know that my partner loves me very much because she always expresses it. She always tells me how much she loves me and also shows it to me as well. She is always willing to go the extra mile for me and is willing to help me whenever i need it. Even if something is bothering me or is affecting me negatively, she is willing to talk to me about it and help me fix it instead of abandoning me. One of the things that i am uncertain about is what bothers my partner at times. She is someone that likes to hide things from me because she doesn't want it to stress me out. If she is having a terrible day at work, she would often not saying anything about it but i can see the expression on her face that something is bothering her. Another thing that i am uncertain about in our relationship is how we deal with money. We don't really have any rules in our relationship regarding money. It's more so like we just take turns paying for things.",10,3,4,5,4,5,6
"We have been together for about 10 years and married for almost 6 years so we have a pretty good understanding of where we stand with each other. We love and respect each other. Our lives are fairly routine at this point and we have a good understanding of what the other is thinking most of the time. We still make time to talk with each other about whatever is happening in our lives. We are parents so obviously a large part of our life revolves around our children now. We still try to make a point of getting alone time with each other because that is vital in any relationship. I wouldn't say that there is much that I'm uncertain about because we pretty much always have an open line of communication going. I would say maybe the only time there's uncertainty is if there is a disagreement about something and sometimes one of us requires a cooling off period. So maybe in that time, there's some uncertainty about the issue until we talk again and get everything completely resolved. Other than that, I would say that we're pretty strong in most aspects. We make a point to keep things loose and open.",12,6,5,5,5,5,6
"The things in my three year relationship that I'm a certain about are my intentions, as well as the intentions of my partner. I feel that we both are one hundred percent sure that we love and respect each other. As a couple we are in agreement that we want to be together for the rest of our lives. In our relationship, we're both sure of each others needs, wants and desires. We both take the initiative everyday to make that a reality to for one another The love and respect between us is obvious and on full display.  The things that I am uncertain about in my relationship is my girlfriends behavior when she's not in my presence. Though I believe that we love and respect each other emotionally. Physical desires aren't necessarily connected to emotions. Plenty of people in committed relationships have affairs. I would not say that this is a thought that worries me, but it is definitely a concern. I have no way of knowing if this type of infidelity is taking place. Which leads to a lot of uncertainty when i thinks about the possibility. I would like to think it isn't, but how could i know for sure.",13,4,3,4,5,6,6
"I am certain about how my partner and I feel about each other. We both love each other equally and agree that we are completely committed to each other. Neither of us has any intentions of ending the relationship or pursing other partners. We both want to stay together and are very happy with our current relationship, so I am also sure about our level of commitment to each other. One major thing I'm uncertain about is our view about marriage. I am not in a rush to get married again, and am very apprehensive about doing so. On the other hand, he wants to get married soon. I trust my feelings about him, but I know that things and feelings can change. I'm mostly concerned about his feelings changing after we get married. I don't want to get trapped in a marriage to someone who doesn't want to be married to me any more. I want to take our time and get married sometime in the future, but he thinks if I don't want to get married now I never will, which isn't true. I just want to be careful and have both of us absolutely sure that's what we want to do.",14,3.5,4,5,4,5,6
"I am certain that I love my wife, and that we have similar temperaments and personalities that compliment each other. I like spending time with her and enjoying activities with her. We like a lot of the same hobbies, and both have similar ideas about how to enjoy life. We like the outdoors, going camping, cooking meals together, watching Netflix or even doing puzzles. We are both introverted people and prefer doing things at home or in small social settings than to go to large parties or gatherings. The things that I am uncertain about though are related towards careers and where and how we would like to establish our lives. My wife is very invested in her career, and would like to move to a larger city to get a better job and have more opportunities available to her. I work in construction, and while I enjoy the work I do, I see it as more of a means to an end, to enjoy life. I would like some day to buy some land, have a large garden, and maybe own some animals. My wife doesn't want that at all. I can foresee that in the future we might have some conflicts around that.",16,5,3,5,4,6,6
"I feel that my relationship with my spouse is a good one.  We have been together for quite some time and feel stable.  I feel certain that I can discuss any issue with my partner.  We understand one another at this point and time and while we do argue, we still respect and love one another.  I feel certain that if there were any problems I would be able to discuss them and have my thoughts and feelings understood.  I cannot think of anything uncertain, we are best friends to be honest and work well together.  We have been together long enough I can tell when my partner needs to talk, or has something on his mind before he says anything at all.  The current state of our relationship is one that I am proud of, it has taken us a lot of time to be able to understand one another the way that we do.  I don't believe that either of us would remain in a relationship with one another if we didn't understand each other the way that we do or had any doubts or uncertainties about one another, there would really be no point to that if I am being fully honest",17,6,6,5,6,6,6
"The things I am certain about in my relationship - I am certain about our commitment to each. I am certain about the goals that we have for each other, for our relationship and for our careers. I am certain about the values that we have. I am certain about the expectations that we have for each other. I am certain about what we have in common and about what we have a different opinion about. I am certain about what we want for our future and how we make that happen. I am certain about how we feel about each and how much we love each other. I am certain about how we support each other. I am certain about how we protect each other. I am certain about our loyalty towards each other. I am certain about how we communicate in an honest way to each other. I am certain about how we fill each others needs and wants. I am certain about the trust we have in each other. I am uncertain about nothing in our relationship. We are not perfect and we have issues from time to time but uncertainty is not a problem for us. We believe and trust in each other.",23,6,6,5,6,6,6
"I am certain that I want to be with my husband for the rest of my life.  We have been together since we were 19 and have grown and matured together for 14+ years.  Having children has solidified these feelings, as he's a wonderful father.  We support each others needs and goals and work towards them together.  I truly feel like we are a team, and will work together to achieve whatever we want.  We are open and honest with each other, and whenever we are having a hard time we help build the other person up.  We are the 'soft place' for each other, that everyone needs, in this harsh world.  I can tell him my deepest thoughts and dreams and know he will only have good intentions.  I am certain my husband wants the best for me and will do what he can to get that. I don't have uncertainties in my relationship.  Everyone has gone through ups and downs, but we have never even come close to breaking up in all the years we've been together.  Sure we argue, but those true core 'issues' couples can have are not there.  We have always been loving and respectful to each other, even in heated disagreements.",24,6,6,5,6,6,6
"MY RELATIONSHIP WITH MY LOVER IS VERY CERTAIN.BECAUSE SHE HAS THE MOST UNDERSTANDING PERSONALITY AND ALSO ME TO HAVE THE SAME LEVEL OF UNDERSTANDING.BECAUSE IN THE RELATIONSHIP UNDERSTANDING HAS THE MOST IMPORTANT ROLE.SHE WAS GOOD LOOKING PERSONALITY BUT I DON'T AN EQUAL LEVEL OF PERSONALITY BUT STILL ALSO SHE LOVES ME VERY MUCH. WE HAVE THE RELATIONSHIP OVER TWO AND HALF YEARS BUT STILL ALSO SHE CARES ME AND I CARES HER VERY MUCH.AND ALSO SHE HAS MEET THE QUALITY WHAT I WANTS.AND ALSO EVERYBODY TOLD US TO ""MADE FOR EACH OTHER"".AND BOTH WE HAVE REALIZED OUR RESPONSIBILITY IN THE BETTER RELATIONSHIP.AND I LIKE HER VERY MUCH DUE TO SHE HAS A VERY HELPING TENDENCY TO OTHER.THIS HABIT I LIKE HER VERY MUCH.THERE IS SOME PROBLEMS ARISE TO BOTH US.BUT BOTH OF THEM READY TO ASK A SORRY TO EACH.SO,EVERY BIG PROBLEMS BETWEEN US GONE VERY QUICKLY.IN THE MONEY LEVEL WE BOTH ARE IN MIDDLE CLASS BUT THERE IS NO SHORTAGE OF HAPPINESS BETWEEN US.DUE TO THE REASON FOR UNDERSTANDING.IN MY POINT OF VIEW IN A BETTER RELATIONSHIP UNDERSTANDING HAS THE MOST ROLE,THAT'S WHY I TOLD WE ARE HAPPY UNTIL OUR DEATH.",32,6,6,3,6,6,6
"My wife and I have been married for 7 years and been together for over 15, so we are pretty certain about our relationship.  We are both working towards a lot of the same goals both personally and family oriented.  We strive to improve our health, our financial situation, and the overall mental well-being.  My wife and I both know that we are each other’s soulmates and know we will be together forever.  Oure relationship has lasted this long because of our commitment to one another.  Overtime we have come to know each other very well and know the rules of our relationship including behaviors, how to communicate, and expectations of one another. I think the biggest uncertainty in our relationship revolves around the desired size of our family.  My wife and I currently have a four-year-old son and I am pushing for having one more child.  My wife, on the other hand, is a bit hesitant to start the process all over a raising a baby.  We keep the lines of communication open on this subject, but the decision is still up in the air.  I know that we will come to a decision that works for our family and a decision we can both agree upon.",39,5,4,5,5,6,6
"I have known my wife since I was 17 when we first started dating. Now at 41 we have been married for 6 yrs. We have literally been a couple for more years then we have not in our lives. There isn't much if anything we do not know about each other. How we feel about politics, favorite foods, type of movies we enjoy.  I do not have any uncertainty about any issues or future plans. I do not believe she does either. We will more then likely grow old together and continue to enjoy life together until we die of old age. We talk things through like a couple of adults, have for a very long time. We air any frustrations we may have in a calm manor and work through them best we can as a team.  We are both black sheeps in our family so we have learned well how to work together as it sometimes feels like it is use against the world. It use to be a drain on us when we were younger, so much work, especially when its coming from both sides. At this point though we go back to back inviting it to come as we both know we can more then handle everything.",43,6,6,4,6,6,6
"First of all, this relationship is stable and there are no uncertainties. I truly believe we both are on the same page. We are certain in all aspects of what is important in the future. We have decided when to get married for example. We have decided to try and have two children. We know when to give each other space, we respect each other and our work. We have goals separately and several in common. We have different groups of friends and many common friends. If any uncertainty arises in the future, I think that we both know how to process any questions and pose any doubts. We have talked extensively what we deserve and need to be happy. We have chosen to be with other because we make each other happy. If there are any disagreements we share them and compromise to find a solution. Life and love is about compromises to make each other happy. We are stubborn sometimes, nothing is perfect, but we are mature enough to get upset and wait until we cool off to talk. I guess the only uncertainty would be if i died today, I wouldnt be with her anymore. This is the most secure, adult relationship I have had, and I am the happiest.",44,6,5,5,6,6,6
"There is actually very little that I am uncertain about in my relationship.  I have been married to my husband for almost 20 years and we pride ourselves on our strong ability to communicate.  Very early on in our relationship we moved away from all of our family and have spent our entire adult lives relying on each other to get through all of the ups and downs that life has sent our way.  We are very proud of the strength of our relationship and both of us would say that each other is our best friend.  We both talk frequently and text during the day because we want to hear the other person's opinions on matters.  We'd both rather spend time with each other than with anyone else, excepting for our children.  We look forward to being with each other, we spend time each evening talking through things and making sure that we are on the same page regarding our lives, our parenting and our decisions.  We actively make plans for what our future will be because we are certain that we want to spend time together even more when we are able to finally retire.  Pretty much I have no doubts or concerns about this relationship at all, there are no uncertainties for us.",56,6,6,5,6,6,6
"We have known each other for a long time but when she was sngle I wasn't and when I was she wasn't and eventually we were available at the same time and the relationship took off fast. We have everything in common and rarely disagree on anything outside of what to get for dinner at the chinese restaurant. We both save our money and are both good at placing a value on items that need to be purchased so we get more for our money. We are able to talk about anything do to our years of friendship. Our sex interests are similar so no issues there, same type of music and movies. It's an ideal relationship. The only issue that would be uncertain is her job as she works for ATT and if she were told to move to Kansas City or Texas as part of her job, would we beable to stay a couple. I cetainly would not stop her and she would not want me to lose my position where I'm at to go with her as a couple. If a seperation instance popped up like that I am uncertain on if we would stay together or not. ATT does move managers around and it is a possibility though she has not experienced it yet.",60,4.5,4,4,4,6,6
"Things my wife and I are certain about in our relationship by far outweigh those we are uncertain about.  We are both certain about how much we love each other.  We are certain about how much we are happy, satisfied and content with our relationship.  We are certain about how we want this relationship to last the rest of our lives.  We are certain about how much we are on the same page about things like finances, child rearing and similar family matters.  We are certain about how we enjoy the same things like similar hobbies (gaming, soccer, golf, gardening).  We are certain how we support each other in our jobs (we are both in tech) and how we use our different disciplines to help each other in our respective jobs.  We are certain where we see ourselves in the future, both near and far. The things we are uncertain about is a very short list.  We are uncertain what will happen when one of us passes.  It is unpleasant to think about but something we should probably better prepare for just in case.  Another uncertainty is what we plan to do in retirement, we have some vague ideas but we haven't really put anything down in concrete as retirement is still a bit a ways off for us.",62,6,5,5,5,6,6
"I feel as though this relationship has changed me for the better, before I was more shy and didn't really go out and do much but since being with him I am more open to new experiences and meeting new people. I have also done a lot of things I didn't think I would ever do (going to Canada, meeting my favorite singer Kelly Clarkson, going to casinos). I know that one day we will get married. We are in love and have been for years. Neither of us have ever felt this way about anyone before. I also know that we will adopt kids one day because that is something we both want. The only thing I am uncertain about is how many kids we will adopt. I almost want two but he wants just one right now. This is something that one of us will have to change our minds about but I guess that is something we will talk about when the time comes. I am certain that one day we will move into a new house, in the same state but maybe a different city, and it will have a bigger backyard for a dog we will get one day. I am certain that he will want us to get another cat as well for our current cat to play with.",73,5.5,5,4,5,6,6
"My wife and I have been together for over 14 years now, and it started as a long distance thing for the first 2 years, which made defining the terms extremely important for us. If we didn't get on the same page about each of our roles and expectations, then it never would have lasted through those first couple of years when distance can create trust and intimacy issues. Once we were married and with each other every day in our own place, we further solidified those expectations and the roles we planned to occupy and pursue for the future of our relationship. The key was and is always communication. Even the closest couple can't be mind readers so it's extremely important to talk about things that are bothering you before they become a ""thing."" We are both committed to each other for the rest of our lives, and have financial and relationship goals mapped out all the way until retirement. The only uncertainty we ever seem to face are the challenges of parenting. Our son is a huge variable, and no amount of planning can prepare us for what he may or may not do. Once again, this is where communication is extremely important, as we must get on the same page to have any kind of hope of success as parents and as a couple.",77,5.5,5,5,5,5,6
"I have no uncertainties in my relationship with my husband. We are both Christians, and we put God first before anything or anyone else, even each other. We both pray for God's will to be done in our lives. We love each other, and we are each other's best friend as well. We even work together. We do have our own interests, but we have a lot of shared interests too. We pray together a lot, and we attend church and Bible study together. These three things strengthen our relationship with one another. We do have problems, mainly financial and health-related ones. We do not let this interfere with what we mean to each other though. We always have each other's back. This also is not to say we don't have our squabbles. I don't know a married couple alive who does not have them. We do irritate and frustrate each other now and again, because we both have strong personalities. We are quick to put it behind us though. We have never gone to bed angry or upset with one another, because that is just not who we are. We truly do have the best relationship with one another, and we are excited that it is an eternal relationship too! Putting God before ourselves is the reason we have such a successful and wildly happy relationship.",81,6,6,6,6,6,6
"I'm certain that we are a great team. We come from families that are passive-aggressive and terrible communicators so we have made it our priority to really make sure that we speak openly about everything - from things that make us happy, appreciation, goals, to things that bother us, annoy us, or seem like they could be issues down the road. We are certainly in love and absolutely plan on staying together for the rest of our lives. We are raising 2 beautiful children together, and that has really come with it's own issues, but I'm positive that there is no better person out there for either of us that is more doting, supportive, or aware of the other's needs. I'm certain that we know that being in a marriage is about helping each other in a way that makes each other's lives easier, love is simply not enough. We know that things aren't always 50/50, and we do our best to pick up each others slack when the other one isn't at their best. We don't keep tally of each other's faults.  I'm uncertain if there will be trials and tribulations down the line that we couldn't anticipate that may drive a wedge between us. While we work wonderfully together, I just can't know if there's something that we haven't experienced together that may cause issues that we can't work through. I would hope that something like this doesn't exist, but it's an uncertainty.",105,5,5,4,5,5,6
"I am certain that we are in love and committed, and will stay together forever.  We have been together for 18 years and happily married for 16 years.   We certainly have the same goals in raising our family and spending our lives together.  We certainly enjoy one anothers company and love to do things together.  We have common goals and love ""doing life together"".  I am certain that both my husband and I are happy and content in our relationship and want to be together for all time.  I am certain we are not ever going to part ways.  I am uncertain about the state of our relationship in regards to sexual attraction.  We have been together for a long time and it feels a bit more familiar, like friends, then a sexual relationship.  We are not intimate nearly as much as we used to be.  Although the romance and friendship are still there, the sexual aspect has been removed somewhat. I am also uncertain about out future goals, later in life, say 10 years from now.  We are in mid forties and have a daughter who will be off to college in 4 years.  What we will do as we are older adults is up in the air at this moment.  We havent discussed the reality of what we will do in retirement, when that will occur, or how we will finance it.",106,4.5,6,4,4,6,6
I am certain that we will last forever.  We still talk and touch like we did when we first got together.  We got married after knowing each other only six months and after 8 years we still feel the same about each other.  We have a strong bond and I do not see it ever breaking.  We have been through just about everything that could possibly tear us apart and are still standing strong.  We do fight and sometimes we do not speak for days at a time but that is not enough to tear us apart.  It makes our relationship stronger when we take the time to look at the other side of an argument.  We fight over how to raise our kids mainly.  I am the more stern parent and he is more laid back.  He says I am too mean to our kids.  This is what usually makes me more mad than anything.  I tell him he can not let them do what they want or they will not respect him.  We also argue about money a lot.  I will tell him there  will be a certain amount in the checking account after such and such clears.  Then he goes to the ATM and thinks that we have a different amount and goes out buying all kinds of crap.  Which then leads to a huge fight because I have to pull money from savings to buy gas and groceries until we get paid again.,107,5.5,5,3,5,6,6
