TEXT,ID,Human codes,gpt-3.5-turbo,Claude 2,llama13b-v2-chat,llama7b-v2-chat,Relational Uncertainty
"Our relationship is very comfortable. We are clear on what we stand for and what we want for the future. It’s also fair to say we are just as clear on what we don’t want. We are very in tune, rarely have arguments and really support each other on a deep level.  What we agree on is that we know what bases are relationship. For instance, ethics, mutual respect, intimacy, love of family, travel, religion,  and personal growth are important to both of us. We give each other space we need to grow in these areas, and as a person. We believe that life is worth experiencing and each day should be considered a gift and live to the fullest. In addition two supporting family strongly, we believe it's our job to be good stewards and citizens of the world. This means better focus on environmental issues and  easing human suffering is at the forefront of our beliefs  and values. We focus on these areas because at this point in our relationship and our lives we believe it's the right thing to do.  What we also agree on is what we don't want our relationship to be. We don't want to be distant from each other or other people in our community or the greater world. our focus is and has always been on learning about the world and understanding both our relationships place in it as well as our own as individuals.  The above is what we are certain on.  We really don't have uncertainties at all. We are committed to our relationship as well as individual growth. If ever we have doubts or uncertainties, we discuss them right way.",127,6,6,4,6,6,5.19
"I am absolutely certain about the love we have for each other and it being genuine. We have been through a lot and have seen many advertises in our life. We have set a good foundation for our family and that is worth everything. We are great as parents together and both strive for a better future. We understand each other because we come from the same background. We always support each other and are the strongest supports of each other. I am uncertain about when we will actually get married. We have been together for years now, but things are not right financially and that holds him back. I think the hardest part of our relationship is trying to start our careers and balance family life. It gets hard sometimes and that can pull us apart with us being so busy. We had our first kid before we was really in our careers. Us spending less time together one on one can put a strain on it. I've always been certain about our feelings towards each other but the support systems we have beyond each other is little. That concerns me when we cant always see eye to eye. Communications is a big key in our relationship. This is something we always work on also. It always improves though.",63,5,4,4,5,5,5.5
"The beginning of my relationship was an uncomfortable road and a rocky one at that. In the beginning, I was incredibly insecure about my relationship. Granted, some things did happen that would make me feel that way. I didn't know where we stood and if it was something that she even wanted to be apart of. This was also my first time ever being in a long distance situation, which was incredibly new to me. We were working against a lot of odds it felt like, not knowing when we would be able to see each other next. It made everything much more intense and we got even closer than if we weren't long distance. Today, I am incredibly confident and certain in our relationship. We are able to talk about almost everything and we have a decent form of communication. Most of my insecurities around the relationship is that there was no way they would want to be in a situation where we can not see each other. The things today that I am certain about is where we are heading in the future, the things we would like to accomplish together and the plans we are making for our future.",7,6,3,4,5,5,5.44
"I am certain about most things in our relationship. I am certain that my boyfriend loves me very much. He always tells me how much he loves and appreciates me. We have been together for awhile, and I know that he cherishes me. I also know that I love him very much and I appreciate him a great deal. We have been together for awhile, but there are a few things that I am uncertain about. For example, we are getting ready to move in together in a few months. We have always lived separately. I am fiercely independent and introverted, and I'm not sure how I am going to adjust to living with him all the time. Right now I think I will be happy living with him, but I can't say for sure. It's unknown territory for me, so I will have to see how it goes. Hopefully I will be happy living with him and we will have a happy life together. I am also somewhat nervous that being together all of the time will lead to resentment between us. I value my privacy very much and it might be hard to adjust to having another person around all of the time. I'm worried that I will fall out of love with my partner the longer we're ""stuck"" together.",68,5,4,5,4,5,5
"The things I am certain about in my relationship/marriage with my husband is loyalty. We both know what it is like to be cheated on and we both know what it feels like to be loyal. Cheating is not acceptable and knowing that both of us has experienced that trauma, make us more devoted to one another. I am also certain about our life goals. We both want a house and children and we have a financial plan that we are putting into place to make sure those are achievable. We also share morals and values. We are huge fans of respect and make sure that we do for others more than we do for ourselves. We are certain about our faith in God and we both know how we can please him and how we can do for others as well. Some things we are uncertain about is our intimate relationship. We both are very awkward when it comes to this and I don't think we are on the same level. He has had relationships in the past based on intimacy and did not have the emotional connection with his past girlfriends. I had the connection emotionally and physically. I have no problem being intimate with him except for my personal insecurities of being too fat or ugly. We both are trying to make changes when it comes to this so that we have an equal amount of intimacy and emotional connection in our marriage. We are also a bit uncertain about our family dynamics. His brother has a wicked wife that is trying to split up the family and my husband and I kind of bicker back and forth about how this affects the family. One thing we can agree on, it is destroying his family. Over all, my husband and I have a very loving, deep connection and I know I want to be with him for the rest of my life and so does he.",140,3.5,5,4,4,6,5.25
Certain I am very certain that my partner loves me a lot. She is a very faithful and devoted wife. We share a lot in common. As a couple we like going places and making great memories. She is always positive about doing things together. Both of us love gardening and do it together most of the times. We love food and cooking. She is a great baker and I like making meat dishes. We complement each other. We are certain about our financial goals as a couple. Each week we sit down and review our financial position and how we are doing towards our savings and retirement goals. We shop a lot together. She loves buying clothes for both of us and I buy mostly gadgets and household goods.   Uncertain We are uncertain to some extent whether we want to have kids right now or some time later. She is focused on her career and don't want this decision to hamper her professional prospects. We want to have kids for sure but not certain about the timing. We are also uncertain if we should invest in real estate. We are thinking for a long time to buy  a second house but are very uncertain looking at the current political and economic condition.,46,4.5,5,4,5,6,5.38
"I am certain that our relationship is strong and that we are very good at communicating. We are a strong team that definitely pushes each other to be better and to achieve our goals. We have achieved a lot since we have been together and have made a lot of dreams comes true. Personal dreams and dream of our relationship.  We are definitely quick to have a heart to heart if we feel that something needs to change or if we are unhappy about a certain aspect of whatever situation may arise. Coming from a broken family, the uncertainty is always there of ""will this relationship ACTUALLY be able to go the distance"". Although right now you feel that you're different and you're doing everything so perfect, you never know what the future holds. For someone who never in their wildest dreams could imagine that their parents would split it, it actually did when I was in my early twenties. When people divorce after 30 years together, it makes you questions your own relationship and wonder if anything is even worth it, if we're just going to go through heartache in the future. And in the back of my head I always have that uncertainty is my partner loves me the same amount as I do and if they are secretly holding back things that will cause our relationship to implode one day.",86,4,2,4,4,6,5.25
"Currently we are pretty happy about everything. We are secure in our work and home life. We seem to be happy to the point we are planning on getting married in a year or two. We both are happy with sex, money, issues in the relationship, and how we handle issues if the problems arise. We are level headed so if something does go wrong we dont run around with our heads cut off. We are also on the same page as how many kids we want and even the type of house we want. Overall we are pretty good right now and I dont see anything major that would cause us to not like each other or cause a breakup.   As far as things that are uncertain, its mostly issue with the job. We both work at stable places but they want to sometimes send us to other offices in different cities. This sucks and normally dont like it but its normally short for a few weeks and we do get through it pretty well. My girl friends job wants to post her perm out of state because shes pretty good at getting things done there. Problem is mostly should she quit her job or should I and then find another if we do move. I wont just leave her over a job but it is a little stressful.",83,4,5,3,5,5,5.13
"The one thing I am most certain about in our relationship is that we have very similar goals when it comes to training, nutrition, taking care of our bodies and building our physiques in order to make them not only impressive visually but also healthy inside out at the same time. I’m certain that having similar goals in that regard helps us a lot when we go out. Our food choices at the restaurants are restricted because we don’t simply eat everything. We count the macronutrients and overall calories in everything we consume so it is of vital importance our food choices to fit our eating protocol and to coincide with one another. I’m certain that we are both benefiting by being in a relationship and taking care of our nutrient needs.  The one thing I’m not really certain of is whether she likes my entertainment choices or not. What I mean by that is that the TV shows and movies I choose to watch with her might not appeal to her taste as much as she wants to show to me. Maybe I am imagining things but I don’t think her favorite genres are Science Fiction and Fantasy and she just acts in that way because she doesn’t want to break my heart by not being so enthusiastic about those Movies/shows that I adore.",76,3.5,4,4,4,6,5
"Things I am certain about: that I love this man with all my heart, body and soul; that I am IN love with him; he means the world to mean; I would be miserable without him; He's my best friend. I'm pretty much certain about all things surrounding the fact that I love him. I'm certain about the interests that we share and where we have our differences. I'm certain about the way he thinks and feels about things on a moral scale. I know we enjoy spending time together because we are bursting with fun and energy when we do. And long for each other when we are apart. I know we enjoy each other.   I am not uncertain about many things when it comes to my relationship with him. I love him and that is what matters. Some things I'm not certain about include: If he actually needs me the way I need him; If we will be together forever ( thought I think and hope and wish this to be true), If he really knows how much I love him. Uncertain if we want more kids, I'm not sure how he feels and I'm not really sure how I feel.. we should probably talk about that soon.",34,5,5,5,5,5,5.06
"My husband and I met in high school and are now in our early 30's. We've weathered many tough situations together including relocating, career changes, and medical issues. Time after time, my husband has shown me that he cares and that he stands behind me 100% of the time. I feel that my husband and I have a nearly rock solid relationship that has what it takes to last.   We have now have two boys together, one 4 years old and the other just 2. We have shared ownership of our home for over 5 years. My husband works hard to provide for all of the finer things that we all enjoy. The both of us come from troubled backgrounds so we really find great comfort in being able to relate to one another. I feel like I can be completely honest with my husband. He's not very judgmental at all and gives me very sound advice whenever I need it.  I feel like I've come to know my husband really well and cannot imagine any other life without him. I'm certain of our relationship because I don't ever want to be without him. In May of this year we celebrate 10 years of marriage and I look forward to many, many more.",50,6,5,4,6,6,5.06
"We are married so we have long since established our set behaviors. I am certain that our relationship is pretty strong. We both care about how the other is feeling and doing in life. We both have similar ideas about money management. We are on the same page mostly politically more or less. We both can tolerate missed dishes or messy rooms. Neither of us want children.  Uncertainty lies in a few areas. For me I have some health issues and feel less than at times. It makes me think I am dragging him down with me since it's hard to be employed with them. If they progress I worry it will be very hard on our relationship. Medical bills have made our stress levels go up a bit money wise.  Also I want a dog. He is not very big on adding responsibilities to our life. While he knew I'd get one eventually, I worry it will add strain to our relationship. If I get worse some of that will fall to him to take care of so I can see his concern.  He is also going back to school. He is already employed and has a degree but he wants to help out the emergency management for our county and it would require an added certificate. So we will have less time together to bond and further cement our relationship. Also if the fafsa doesn't cover everything we will have to add on to our financial burdens which I already stretch.  Also I am going away for a month or two to visit my sister. She lives quite far away from us so we will have to keep touch with a phone or computer games. He doesn't like me gone that long so that will add to any tension we have already going.",137,5,4,5,4,6,5.06
"We're both on the same page and are certain about what we want in life. We discuss our plans and views we have towards the future, we discuss monetary issues and goals, we have a set plan for the both of us which is progressing at this point. We are also certain about the feelings for each other, we've discussed this at length and I can feel comfortable knowing how my partner feels. We've been together so long that everything that interfered or could cause issues with the relationship has disappeared. I know that I can trust and rely on my partner and that she trust that I will do the right thing all the time.  I'm uncertain about day to day things that I think most people are. For example things like where we should keep living, who we should keep getting a long with and meeting. This depends on the person. I like some people that my wife is not fond of and she has some friends that I don't like. This is usually a point of contention however in the end, it's what makes each other happy that counts, so we don't dwell on it.  We're also uncertain about the dynamics of job and working. My wife wants to work less and I want to work more to save more money. While those issues are minor and they rarely come up, they are still an uncertainty.",94,3.5,5,3,5,6,5.19
"Well my wife and I have been together for 11 years now.  I really can connect with her on almost every level.  We are into the same things, like sports and food.  We love to go out to the game and have a nice time just watching it and having a beer and something good to eat.  She is always able to really be there for me when I need something and really most of the time she can sense when I need something.  I was attracted to her the moment I meet her even though we were just friends when we first meet.  Even with all of the great things that our relationship offers the one thing that I am not always certain about is her sexual desire for me.  She has not always been the most forth coming when it comes to things of that nature.  She has almost never initiated a sexual encounter and seems a bit put off most of the time when we are together.  I have always asked her about how she is feeling when it comes to our intimate relationship but I do not always feel that she is giving me an honest answer.  I just really am always on the fence when it comes to how see feels about our sex life and would really like to get to the bottom of the problem whether it is me or something that she is hung up on.",99,3,3,5,3,6,5
"We have a very open relationship we talk about anything and everything and Iam luck enough to have found somebody who has my same values,morals, and wants. We very seldom disagree. We both love we the are at in the relationship and where we are going. My partner treats me with the upmost respect and cares for me, Iam very luck to have found her, and I treat her the same way. If anything was uncertain about our relationship it would be that she is a state away and Iam starting a new job soon, and Iam trying to work out how to be closer to her and spend as much if not more time with her, while starting a new job, while I have two choices, one doesnt close the distance gap, so Im kinda of scared to take it, although it pays well, and I havent brought this up to her yet, I would like to see her move closer to me, however she has a child and family where she is now, so I hate to ask or bring it up. I know she will say we can work through it, but it bothers me greatly at this time. Thats the only really uncertain thing at this time. Im very certain and secure in our relationship and so is she, when I have questions or she has questions we simply sit down and talk about it, we dont hide anything or ignore stuff, our rule is communication, if you have any questions or doubts we bring them up and discuss them, Iam so lucky to have found her, because we agree on our relationship and how to maintain it, while we may disagree on a few other things, our relationship is stable, happy, and will last for a long time.",135,4.5,5,4,5,6,4.81
"Most of my relationship is based around certainty. We knew each other for a very long time before we started dating, so we knew who each other was and what they wanted before we started dating. Our relationship has had a high level of communication and we talk about everything. I am certain she loves me. I am certain she wants to be with me. I am certain she is loyal to me and that she trusts me to be loyal to her.   The only thing I am really uncertain about is children. We both want children, or at least we say we do, but we don't talk about it much, or when we do talk about it, it's more like a fantasy than something that is actually going to happen. I sometimes feel that she likes the idea of having children, and the she herself really does believe she wants children, but that somewhere deep down she actually doesn't. I've raised this concern to her and she assures me she wants children, but I still don't know if she's being honest with herself. This would be a deal breaker if she actually does not want children. We have invested a lot of time into each other and I want to be with her, but I have to have children at some point.",71,4,4,3,5,5,5
"I have been in my relationship for over 10 years. We both don't want children and never did. That I am certain of. I am very happy about that because I never wanted children. I also know that we love each other very much. We also are interested in the same things, like anime, video games, and photography. He loves golf, though, which I can't stand and that takes up a lot of his time. We do have issues with time. We both work a lot and don't have as much time for each other anymore. It's hard finding time when he has his hobbies and I have mine after work. It's also hard because we aren't married, but are living together. I want to get married soon, but he wants to wait. This puts a strain on things. I would love to get married, but he just doesn't see the point right now. I think it would help us financially and we could try to save up for a house. It's hard living in the bay area where things are so expensive. It puts a strain on our finances. I'd like to move, but he doesn't. So, we don't agree on those things. He also has kind of let himself go and gained weight and I don't like that. He's not as attractive as he used to be. I want him to lose weight, but he doesn't care and says he's too busy with work.",104,2,3,3,3,6,5.06
"I am certain that we do love each other and care for each other's well being. We have a good time when we are together and the feeling after all these years in the relationship have not went away. We encourage each other to do our best and support the strength and belief in oneself to strive for excellence in our lives. We also find each other attractive which is important as emotional compatibility in the relationship. We are able to talk about almost everything with no judgement that we probably have not told others. I do consider my partner my best friend and I know the feeling is mutual too.  The downside is not many but there are a few internal struggles on my part, a little on his that makes me question the state of our relationship.  At times it reach a massive blowup where I will feel bad afterwards. There are also external factors too that makes me unhappy and then  I question my relationship. Not often but when a issue(s) crops up, I'm not exactly a full of sunshine to be around, I must admit. I also wondered when we will get married and back of my head wonders do he truly want to marry me.",37,4,4,4,5,5,4.94
"At this point, I feel my partner and I agree that our relationship is one that is going to last. We both have some doubts from time to time. I'm not always certain that we are right for each other. We have very different personalities that conflict quite a bit at times. Our styles of communication are very different, which sometimes do not mesh well. I prefer to avoid while he prefers to tackle things head on. We also have very different love languages regarding how we express and wish to receive love. It is very hard differing so much across these very important aspects of relationship. I feel that we just don't really understand one another in many instances; however, we both make an effort to work towards a better understanding of one another's needs and desires. One thing I am certain of is our devotion and commitment to one another. I am quite certain that we both want the same things from the relationship. We both have expressed a desire to spend our lives together. We both want this relationship to last for the long haul, with both of us reaching pure happiness together. I am absolutely certain of those things. I am still uncertain how or if we will achieve that.",52,3.5,3,4,4,5,4.81
"There are a few things that I am certain of in the relationship right now. We are both happy with the way things are, we're supportive of each other and want to help each other to succeed in our individual goals. I'm certain that when we have some type of problems, whether minor or major, we can get through them because we have good communication. I know that we both view the relationship as a long term thing and neither of us are anticipating finding someone else they'd rather be with.  One of the major things I am uncertain about is the possibility of children. I've made it clear that it's not something I'm interested in and I think she still wants me to change my mind about it. We do talk about it sometimes but it's not something that can be easily resolved so it's always just something that gets put off for the future and I don't know what will happen. We are also not living together yet but should be making that move soon. I am a little uncertain about whether or not we will be compatible in that regard. I think things will work out fine but there is always some doubt when you get that close to someone.",48,3,3.5,4,4,5,4.81
