TEXT,ID,Human codes,gpt-3.5-turbo,Claude 2,llama13b-v2-chat,llama7b-v2-chat,Relational Uncertainty
"i am quite certain that we can coexist as a relationship unit.  we both have similar likes and dislikes.  our hobbies coincide so we can get along with many things that we do in our leisure time.  we have a strong sense of family and happiness that guides us to have a compatible relationship. i am certain that whatever problems we have we can work through for our long term commitment.  i am certain that whenever we go on vacation we will have a great time together site seeing and going to different clubs to enjoy the scenes.  i am certain that when it is time to do chores around the house, we both can participate and help each other with the work that needs to be done. .  i am uncertain that all this happiness can last for the rest of our lives  you never know when a tragic accident can occur and it can all be over in a moments notice.  i am uncertain that when there is a petty argument that it can't be stopped into a big argument that can cause unnecessary problems.  i am uncertain that during times of immediate family crises that sadness will not subside and we will have to go through hard times to grow our relationship.  i am uncertain if our likes for hobbies will continue as well.",78,4.5,5,4,4,6,4.88
"I'm certain that my wife loves me and I'm certain that I have the same mutual love for her. I'm pretty certain that we equally love our family that we've created and we wouldn't change the for the world. I'm certain that though we may argue and say that we are leaving sometimes that it's not going to happen because we have a house that we've both but our money and time into. I'm uncertain of how long the relationship will last in the long run, though, as ""forever"" is a very long time and I'm sure she feels the exact same way (I know her). I'm uncertain that our relationship progressing; it's actually rather complacent so I'm not sure if that's going to hurt us in the future. Also I'm not sure how long our sex life will continue to keep up, as it's already went a little down hill since all of the kids were born. We used to go at it like rabbits for the first few years but now we are so busy with everything else that sex is not on either one of our minds, it seems. The last thing I'm uncertain about is my wife's family; not that I'm uncertain about how they feel about me, but rather the fact that I don't too much care for them and a lot of the time my wife allows them to interefere in our relationship.",95,3,3,3,4,6,4.81
"Well when our relationship started, it felt a lot more like a friends-with-benefit relationship for a couple months, we didn't really know if we were boyfriends or not because we were inexperienced and did not really want to talk about it. However, with time we started talking more and we officially announced ourselves as boyfriends and honestly it felt really well. We currently do not live together and he barely uses his phone so we do not talk a lot during the day but i am confident that he is loyal to me but you can never be certain. I am certain that he equally loves me as much as I love him now that we've been dating for a little over a year but I am uncertain on whether or not he wants to see me as much as I want to see him. I am kind of the kind that gets attached too quickly and loves to cuddle at night while he is the independent kind of guy and prefers sex then cuddling. Our libido isn't the same. To be honest, you can never really be certain if someone loves you as much as you do until you ask them to marry you knowing there's no other aspect of it encouraging them to do it (money). But each relationship is an adventure to its own, and it is up to the relationship people to achieve their adventure to the fullest.",97,3.5,3,4,4,6,4.19
"I am certain that we were connected for a divine purpose.  I fully understand the complex nature of our relationship given our spiritual beliefs.  I am certain that we both have a deep love for each other.  I am certain that we both have a deep respect for each other.  I am certain that at this time I am the only one in her life and she is the only one in my life romantically.  I am certain that her actions our clear in regards to how important I am to her.  Although sometimes I am uncertain if she knows how important she is to me.  Even though, we both agree that their are boundaries currently in place in regards to how we can express our romantic feelings that we have toward each other, we have been delicately trying to approach alternatives way to redefining our relationship in hope to guarantee longevity.  We have agreed to independently handle the feelings that we have that conflict with our spiritual belief and many of times we remain silent on these feelings.  Every now and then we will briefly acknowledge that we still have issues reconciling them and attempts to perhaps put distance between each other just do not work.  Somehow we find ourselves back into the same rhythm we've had since I first met her.  Seldom are we apart so I'm uncertain if I can interpret that as if we will continue to maintain the relationship for what it is.  We are not seeking to compare it to others.  We are not defining it by anyone else's standards.  That is what I am certain about.  I am uncertain that because of our spiritual beliefs if we try to force the dynamics of our relationship to change that perhaps we won't last.  I am uncertain and I would almost bet that she is uncertain if our spiritual beliefs will allow our relationship to continue to grow and blossom.  I love her and she loves me that we are both certain of but uncertain just how far and how long the love will keep us together.",146,3.5,3,4,4,6,3.81
"The status of our relationship is great so far. I feel that we have much more positives than negatives. Our positives are we both are the non-argumentive type. We rarely get into arguments or disagreements. We also are both into religion. I feel that brings us and our families closer together. Personally, I am very committed to our relationship and have plans for us in the near future. On the other hand, we do have some negatives as well. We are uncertain about when and where we want to have children. I want us to wait until were settled down in a better place and possibly a new state. My partner wants a child asap but is willing to look from my point of view. Every now and then we do argue, but quickly make up. Also, us working so much means were not able to spend as much time together. I work during the days and she works during the evening some days. We have never had any issues as far as cheating, commitment, etc. I believe that my partner shares the same opinion about our relationship as I do. We both very happy and eager to start the next step.",9,3.5,5,2,5,5,4.13
"i hope good relationship move on with my partner, we are enjoying the good relationship. My partner very fit to me, any sorrows and failures she came cheer-up with me. Very helpful person for my partner. Everyday we are enjoying with our own life, I say one thing share with you because this is very awesome moment in my life, one day me and my partner walk with the road, this time was rainy moment, we are see in old couple in cross the road, That old lady very take care for that old man. This moment change in our life because we are how many ages comes but not we will fight or any sorrows, Still we going this relationship and same sweet relationship going in our end life. I really like this relationship, i have many achieve my goals back my partner. This is very awesome feeling.  We  dissatisfied with the status of our relationship, we are start blaming and feeling sorry for ourself . our question ourself . These questions haunt we and will be detrimental to our self-esteem. Unless you manage your expectations and do something about your relationship. sometimes very upset both are me.",5,4.5,3.5,4,4,6,5
"We started dating 7 years ago. Even now, I’m unsure if our feelings are mutual. He is a lot more affectionate than in the beginning but that, too, is fleeting sometimes. I’m not sure if he is in the relationship, because he needs me or has genuine caring feelings for me.  Other than that, he is silly and does things to make me feel warm, smile and envoke my curiousity often. Everyday, I look forward to seeing and being in his company.  The things that I’m certain about is that we will be together for a long time. During that time, I will enjoy his company. He will continue to be himself that I have enjoyed for years. Our personalities won’t change much.  The things I am uncertain about are his feelings for me. What my feelings will be for him once he gets older. Will I be as patient? I think about our health a lot. Will I be able to be there for him as I have been? Will we have the same relationship once we cannot spend as much time together? Will it actually improve our relationship?  I am considering having a kid. I’m also not sure how he feels about that. Sometimes it seems like he likes kids and sometimes he does not.",59,2,3,2,3,6,3.69
my partner is very important in my life. Its good person he have share any thing to me. he has help full in every second in my life. I like and love him. every day i fell new avenger in my life. its very honestly love him. its full of mixed in my life and every ware. last week my birthday celebration its going the fantastic moment in my life my partner it change to happy moments for full day. That day me little sleep to sex in my partner. true lover are also friend maybe impossible to keep sexual excitement at the same fevered pitch it might have been at the very start of a relationship. its my good level to maintain in my partner to the going well in my relationship. my friends and family very helpful in my relationship. all most going to married in few months so enjoy my lovely relationship. more time sex with in my partner in differs please its can ever all over to be go well its over to enjoy my life. both member to accept my relationship and get will soon to ready marriage its all the thinks. very enjoy in my life.  but uncertain small problem in my life its all off thinks there well to be able to some problem faced. its can every moment but not can over to the some irritating.,87,5.5,2,3,3,6,4.06
"I am certain about how much she loves me and were we are going together. we talk all the time and discuss what going on in eachothers lifes. We talk about our sex lives and what we want out of the relationship, we both have decided that we are the ones for eachother. I am certain of how i feel about her and her about me. One thing im no certain about is what going to happen with her sister. im afraid her sister and her boyfriend are going to split up and my Girlfriend will want to take in her sister and I cant stand her sister. I dont like how she treats my girlfriend. I told her a few weeks ago if she moved in with us I would have to move out and she got really upset about it but i dont know what else to do. Im also no certain that I want kids and she does and that causes problems because even though she is in her 20s she still is worried about getting to old to have them. But none the less we have a good realtionship we just need to work on some stuff.",4,3.5,3,3,5,4,4.56
"Actually we both are most certain about our  relationship in the way that we trust each other heartfully to the core, and we respect each other, and also defend each incase unwanted troubles,  which we have proved over time for each other so much and hence we have overcomed all our egos, doubts, and misunderstandings in a big way,Which has helped us very much stay in genuine love, infront of others with pride and conviction, this is for sure, and hence we have become rolemodel to other pairs who are struggling in life, to understand each other, and finally we both have got that courage also, to make it big in life, commercially with lot of love for each other.  And  then uncertainty is only about our families, as whether they support us or not, in future for our happy life, as they are finding it difficult to trust us in all the ways, because of the differences in caste, creed, culture, languages, status etc, where they are worried about what people talk socially, which can damage their  self respects and status that they have earned all these years, hence they just want win win options, till then they are not all fully convinced about us.",25,5,3,3,5,6,4.19
"In my relationship, I am very certain that my partner is committed to me in certain ways. She does care about me and thinks about me during the day. She does want to make me happy when I get home and take care of house chores. She does seem to really value my opinion and ask me for my various opinions and suggestions on a daily basis. She wants to know about my life and think about life in new and exciting ways with me. We do both want to eventually have children together and share our life experiences with them together. We both like to partake in similar activities and go to similar locations and places. There are a few things that I am uncertain about. We do seem to disagree a lot in arguments that we have with each other. We don't like the same kinds of television shows or programs. She doesn't care about her health as much as I seem to value it. I often wonder how smart she is because she doesn't think about long term goals as much as I do. We do seem to argue a lot and disagree on certain topics. I often wonder if we are a good couple because of reasons such as these. She doesn't like sports as much as I do. She doesn't work as hard at certain things as I would like her to. We don't have the same ideas about how our house should look or what kinds of animals we should have. She likes cats and I like dogs. She eats too much food in my opinion and i'm not sure If there is anything that I will ever be able to do about that. I don't know if these things are all important but I figure that I should mention them just in case. I hope that what I wrote is very helpful for this HIT, because I am really trying to think of several things that I can write about. Hopefully we can both agree to disagree with certain things, because we are a great couple and we should really care about each other and take our time to understand that we are good for each other. It is hard to find someone who is perfect, and so I don't want to waste my time looking for perfection. She is a gre",152,2.5,4,4,4,6,3.31
"Well honestly , our relationship is kind of weird. I'm certain that we both love each other tremendously . We have fun and can talk and enjoy each others company for hours. Though, I'm uncertain of the extent of her love, like how much does she really care for me - to be with me for the long term. We both have the same goals, to be successful in our careers and start a family someday. I'm just not sure if it will be with each other at this point. I know I'm committed to the long term, but I could not be certain she is thinking the same thing. I think she feels she does not have much time left, as far as starting a family is concerned. Meanwhile, I want to focus on my job, etc and stability before that. And being the beautiful woman that she is, I know that she thinks she may have better options when it comes to getting whats she wants , even though she loves me. I love her and want to make things work, but one thing I'm sure off, is that if not, I will be ok. I'm certain this is the person I would want to be with for the long run.",31,2.5,3,3,4,5,4.19
"I am certain that this relationship will not end soon and that it still has life left in it. There are numerous things that give me hope that the relationship will persevere and that we will have a future together. It is that time in our relationship that we have to decide if we want to take it to the next level or stop wasting each other's time and whatever happens I will be ok with it. Since there is no way of knowing the future we will have to wait and see. There are a lot of things that I am uncertain about and one of them is if we get married and have children together, will we stay together. I know that a lot of things change once a person has children and your priorities have to change. I am not exactly sure If we will get through tough periods together since we have not really had anything major to go through. I really have doubts if she will be strong enough or supportive enough to go through any major life changes with me. There are also other factors to consider such as what our financial situation would be since we will have a lot more expenses. I guess that you are not going to know everything until it happens and you have lived through it, but I am hoping for the best outcome.",88,3,3,4,4,4,4.63
"Our relationship has only been going on for a short while but it has shown that we get along very easily. We know for certain that we understand each other on almost all major relationship issues and we talk about most issues as they come up to try to settle them out if it is a major enough issue. Most of the time after talking it is usually figured out that there is not much we disagree with after all, and we are mainly just looking at solving the same problem and getting to the same resolution, but with just a different pathway to get there. We know for certain we can get along and communicate well, enough that we know that if we do have a problem, its most likely easily resolved by just a quick talk and clarification. Uncertainty in the relationship might come from more of a long term aspect, since we are a couple that has not had that long of a time together. We both know that over time some issue do develop, but we don’t know if or when that will ever take place. I hope not, but going by statistics and direct information from friends, it would be almost oddly rare to have no major issues come up. Have we not had the life experience to reveal if we do have a major problem? Trust is also grown over time, so maybe there is a little uncertainty on not knowing if what they have revealed to me on future goals and wants out of life are not true, or slightly different then they explained to me.",122,4,4,5,4,5,4.25
"The things I feel very certain about in my relationship with my partner regard our commitments and our values. No matter what is going on in the relationship, I feel assured that my partner and I will continue to commit to one another, that we will share the same values consistently. I am also certain that we will do well with one another into the future; I feel optimistic about the state of my relationship. I trust in the feeling that while we may not be soul mates, we are in love and we will work hard for each other. I am most uncertain, however, about things outside of my control that may put an end to our relationship. Sometimes I can't control things that happen. For example, if health complications arrived unexpectedly, this would be an uncertainty. One can never truly predict the future in regard to health, happiness, and such things. Further, there is the uncertainty that both my partner and I will continue to change throughout our lives together. The people we were when we got together might be very different from who we are at the end, whenever the end is. All in all, I feel certain that our relationship can weather any kinds of disagreements. I also feel certain that the two of us will be successful in life, together.",75,5,4,4,5,5,4.88
"I am certain that we love each other, we enjoy talking to each other and we are friends. Also, i am certain that we like to spend time together. We share many interests in common. We like the same type of movies such as superhero, action, thrillers and comedies. I am certain that we have similar goals in life. One goal is to increase our income so we can have more free time and be able to travel without worrying about budget or finances. In addition, I am certain that we share the same spiritual values. We worship together as a couple and we believe the same core principles of Christianity.  Finally, I am certain that we appreciate the simple things in life. Sometimes we just like to sit home, eat a good meal and watch a movie. This makes us both totally happy.   Things that I am uncertain about in my relationship is how he feels at time. My partner has a tendency to remain stoic during all situations. he is hard to read, therefore I am not certain how he truly feels about a situation. I ask him and he tells me how he feels but you never really see it in his behavior because he has one mode. This makes me feel a little uncertain, because you definitely have to believe what he says. There is no emotional response to view from him. Another thing I am uncertain about is his plans for us after the kids are finished with school. I suggested we move or travel and just experience the freedom of the empty nest. He has not really said yes or no. It makes me wonder if he really wants to do anything at all. I do not know if I want to continue to live in this city for the rest of my life therefore if he does not want to move do I leave him or just spend extra time traveling. I want to maintain my relationship but I want to experience new things too.",144,3.5,3,4,4,6,5.5
I am very certain about where my relationship stands.  We both have a very clear path on what we want to come in the future for us.   I feel as if we both can relate and we both understand what it is that we want in the end .  I guess i can say that i am certain that we would both like get married one day. I am also very certain that she loves me as much as i love her .  Some things that i am uncertain about in my relationship is where we will be in the future because nobody can determine the future .  Other things that i am uncertain about is if we will make it to marrige because of the price that it cost to have a wedding now days can be very expensive and has lots of fees that come along with that .  I am very certain that we will make it work in the end because we are both very compatible together and we have very good communication skills as a couple .  I am uncertain that she will feel the same as she does now in the future because nobody can determin the future that is .,2,4.5,5,3,5,5,4.06
"1) Certain things about my partner is she is so caring and then most of the time we were always caring for each othr we spend most of the times outside we were very much connected she helps me in all axpect in terms of love and support she may not talk toomuch and didn't interfere with personal matters of my life she makes interfere only that makes me worse so she always makes decision based upon the criteria which suites me will but she doesn't go beyond that so most of the time she is calm type and caring .Many teenagers just don t understand the responsibilities that go along with being sexually active, they don t even think about them. But maybe they should sit back and think before taking part. People should not be having sex just to have it, but because they are in love.For us it didn't apply.In the film Good Will Hunting, many personal relationships are displayed. From the beginning, to the end, you can see these relationships grow, while taking an evolutionary course. During the film, Will (Matt Damon), and Skylar (Minnie Driver), experienced such a course. There are six stages that they went through from the beginning to the end, to finally reach Romantic Relationship status.our relationship is just like that. thank you for giving me this oppurtunity.",82,5.5,4,3,5,6,3.38
"Sometimes I'm very uncertain about my relationship. Because I'm never sure what could happen, simply because things can happen. You really never know what could happen with it. Because everything can change and you could never know when it could happen. That's something to think about, so you need to really be cautious about relationships because anything can happen. I'm sometimes certain about it because I feel good about a person and I think that they are really good at what they do to make me feel comfortable and good about myself and the overall relationship. That alone gives me confidence in us and makes me believe that we have a future. With that it makes me understand more about relationship and how I could feel better about all of this, because you know what you have. I think having a good relationship can make you feel comfortable and make you feel comfortable with them. You need to have that because you won't be questioning yourself or questioning that relationship that you are in. That's something I think most people need and want to have so they can feel good about themselves and their partner. It'll also help the relationship and make everything better. You never want to question your partner about anything or make yourself feel very uncertain.",61,3,4,4,4,5,3.5
