TEXT,ID,Human codes,gpt-3.5-turbo,Claude 2,llama13b-v2-chat,llama7b-v2-chat,Relational Uncertainty
"Here's the thing about  my relationships with my partner: MYSELF: DINESH ADITHYAA PARTNER:SARANYA  Sometimes we're candlelit date nights, and walks through grassy meadows, and feeding each other cake at our wedding.  But sometimes we're doing the dishes, and comforting a screaming baby, and fighting over whose turn it is to do the dishes or comfort the screaming baby.  Which is to say, while sometimes my love and passion for each other is obvious, sometimes it's really, really not.  Psychologists have spent years studying the traits that are fundamental to successful long-term relationships and come up with a few key ideas. We rounded up some of their most surprising insights below.   If I notice that our relationship doesn't meet all these criteria, that does not necessarily mean I should end things with my partner. Consider this list a general set of guidelines that can help you start evaluating whether your current relationship is bringing you satisfaction and happiness. There’s nothing more nerve-racking and stressful than having uncertainty in our relationship. When i uncertain of my partner, it can feel like a roller coaster of emotions and doubts, but it doesn’t have to last.  Like most of the blocks we face in our life and relationships, uncertainty comes from fear — the fear of loss and heartbreak, the fear of losing our independence and, most common of all, the fear of the unknown.  We often fuel that uncertainty by trying to protect ourselves from that fear by pulling away, looking for reasons to justify it and maybe even cutting our losses all together and breaking up with someone before they hurt us.",121,3.5,3,3,4,5,5.06
"I am certain about the relationship status, because we both agreed we're in the dating phase but it's still not serious enough to, for example, introduce him to my parents. I'm also certain we both want this to work, so we're putting lots of effort on it. I'm also sure that communication isn't hard in this relationship, because we've discussed plenty of difficult / serious topics and talked about that in a mature manner, respectfully and in a calmed way. I'm also certain this might develop into a serious and healthy relationship because so far, everything has been healthy, respectful and good, so that makes me feel good about myself and the relationship I'm into. I'm also certain we're n the same page regarding marriage and kids, we both want it at some point, but not in the short term, so that's a good thing (And I'm not sure that will happen in this relationship, but at least we're on the same page.  I am uncertain about how long this will last, but I think that happens with every relationship so it's not a big deal to me. I'm also uncertain about his long term plans, I don't know if he plans to stay in this city for so long, and how that might interfere with the relationship at that point. Sometimes I'm afraid to ask about that.",79,2.5,4,4,4,6,5.13
"I am certain that our relation is working well as far as we know , there are arguments from time to time but what relationship does not have ?  All in all we are very happy together and we try to do the best to make each other happy , my wife is everything i ever wanted and i am happy the way we evolve through time. What i am uncertain of is how long will this happiness last , because  there are many factors to think about , diseases , deaths , and many other types of unhappy situations , but hopefully me and her will keep being happy for a long time. But as i said relationships have good times and bad times and there are arguments which are hard to avoid , for example work related , or discussions about having kids or not yet , on one side we need to save money first and have our own house  paid , then to build a family , no relation is perfect that is for sure but we sure do try to make it as easy and pleasant for each other, for example even if there are mild annoyances i try to keep my calm and not explode my anger on her. But in the end only time will tell i believe.",40,3.5,3,4,5,5,4.06
"I am mostly certain about the important aspects of my marriage. We have the same (for the most part) viewpoints on our religion, morals, political stances, and what is acceptable for how married people should behave. We might disagree on some minor things and that's okay, too. In fact, it makes for some very interesting debates when we're just sitting around the house! That isn't to say everything is perfect. He lost his right leg from the knee down three years ago. It has made for some tough times. I have to be much more aware when planning things like shopping-which can get very frustrating at times. There are times when its just simpler to stay home and that gets annoying for him. I wish the world would be more aware of physical disabilities. There are times we both get somewhat snappy with each other over that in particular. It gets old checking before we do something as simple as going out to dinner to be sure the place is wheelchair friendly.  He gets sad when dealing with it at times, but, thankfully he bounces back pretty quick. Other than that, I wouldn't change anything about our life together. We agree on the important things and the little things we always work out.",49,5.5,5,5,5,5,5.69
"Things that I am certain about is the love that we have for one another. I certain of that because it is displayed every day. There is no way that two people would have and continue to go through on a daily basis if they did not love one another. I am also certain about our goals. We both love our children. There is no doubt that they are the loves of our lives in addition to loving one another. Our children do everything with us. We make sure that life is good for them and engaging with high quality stimuli for both their minds and bodies. If I move on to things I am uncertain of, the first thing that would come up is the length of this relationship. It is not because either of us want to go and be with anyone else or just not be together, it is because there is a significant age difference between my husband and me. He is much older, and we get concerned with the fact that him passing long before me is a great deal of uncertain thoughts. There is not anything other than that that I am uncertain about in regards to this relationship. I mean, things like where we may be living in a few years (what part of the world), or what we may be doing for money may change, but that does not cause any type of conversation when we speak if things that we are uncertain of.",109,4,3,3,5,6,2.63
"My partner and I have a very good relationship. We have what I would describe as a mutual give and take relationship. We know where each other stands on all issues. That is not to say that we do not have our differences, but we respect each others different opinions on certain matters. I am certain that I can count on my partner in any manner and she can count on me. We are there to support each other through both the good and bad times. We discuss how money will be spent for the household, while still maintaining our own separate accounts. We have a house budget and agree on any major purchase and equally split the costs. I do not have many uncertainties in this relationship. I know that whatever comes along, my partner will be there and act in a fashion that is in keeping with her character. The only uncertainty would be what she would do if I would pass before her. I would expect that she would be able to adequately deal with any circumstances that arise as she is very capable. I am happy with this relationship as is my partner. We both benefit mutually and have a deep caring and love for each other.",36,6,6,4,6,6,6
"We have been together nearly five years with relatively minimal trouble or conflict, so the majority of the status of my relationship errs heavily on the side of certainty. I am extraordinarily certain about our commitment to each other, the way we feel about one another [both good and bad], as well as the fact that we love each other deeply. I am also certain that we both have the same goals for our relationship over the long term, and that we both want to be together for the long haul. I also have no doubt about our sex life: It's great, and we both have reasonably similar appetites in that realm. We are also both certain about the fact that we trust each other implicitly, and that we both make an effort to withhold judgement toward one another even under trying circumstances. Overall, I think we are both pretty certain about the overwhelming majority of, at least most of the, crucial dynamics involved in our relationship. That noted, I think the majority of uncertainty probably stems from the differences we have. Chief among these would be where we ultimately want to live -- he emphatically wants to relocate, whereas I really do not as I like being near my family. I honestly have no idea how that will play out in the longer term. Another area of uncertainty, for me at least -- albeit slightly mundane -- is how much I can tolerate being the only one [in general, at least] who does the majority of the work around the house all the time with little to no help. It's infuriating at times, particularly considering that I don't have any more or less free time than he does to begin with. There is also some uncertainty, again, for me, with how I deal with my partner's choice to spend such an absolutely inordinate amount of time with his close group of friends. It's been the source of conflict between us more than once -- not least because I just simply don't think they are terribly great people -- and I'm never terribly sure when to say something for my own emotional heal",150,4,5,6,5,6,6
"I have been with my Husband for 23 years, I have zero doubt about our relationship. We have amazing communication skills and we take time out for each other every day. Our relationship is easy compared to most, we are best friends and we WANT to spend a lot of time together. We text each other all day just to ask how we are doing, no topic is off limits. I can talk to him about anything. Our sex life is still very active, we are passionate and attracted to each other. We still hold hands while walking in the mall or what ever. We have two children together and a child from a previous marriage. We have a very relaxed attitude. I never worry that he is cheating on me, we are home together every night. We do everything together, shopping, walking the dogs, cooking dinner etc. I cannot imagine my life with out him, he is the 1st person I go to when I have good or bad news, or just want to talk to someone. He supports me and I support him in his dreams and aspirations. Everyone says we are perfect together because they can see even after all these years how much we love and respect each other",47,6,6,5,6,6,5.56
"We are very certain about our lives and our relationship status.  We met back when we were junior's in high school, which was almost 20 years ago now.  We dated pretty solidly for 2 years, then broke up for a little while before getting back together.  We got married when we were 24, and now have 3 awesome daughter's.   We are certain in our relationship.  Our relationship is based on our God, and his strength between us keeps us strong in each other.  It's not like we don't have the typical problems or arguments, sometimes over the stupidest of things, but we always know that we will love one another, love our family, and nothing will stop us from being together forever, because that is the vow that we made to each other, and to God, over 10 years ago now.   One thing that usually is a contention though is how and where we spend our free time.  Usually we spent it together, but if we split off too much, my wife seems to not like that very much so I tend not to do so as often as I may like.   In the end though, we'll always be together.  I don't see anything that would break that bond between us, I am certain of that.  We have been through a lot together already, and although tough, it has made us stronger together in the end.",89,6,5,5,6,6,5.75
"My husband and I have a lot of things that we are certain about in our relationship. Over the years we have figured out how to approach each other about issues we may be having and how to treat the other person. We both have the same set of values and both have the same outlook on life. We share a common sense of humor and we can cheer each other up no matter how upset the other one is. We both enjoy a lot of the same activities and hobbies and spend time together doing them. In terms of what we are uncertain about is what external pressures will impact our relationship. I have been looking for a new job and that has added stress to the relationship since we are not certain where I am going to end up. We have had issues in the past and I have some concern they may arise again but can’t be truly sure if they will or won’t. For the most part though, we have been together long enough to work through most of our issues and work pretty much from the same playbook. I can predict how my husband will react to most situations and he can do the same for me. That is what 23 years together does for a relationship.",69,3.5,5,4,5,6,5.31
"I'm certain that we both like spending time together, that we both want to get more healthy and improve things like our spaces.  And that together we like making these decisions and steps.  I'm also certain we're both content, and don't get sick of each other.  We like spending a full day together during the weekend, and want to see each other during the week as well.  We both like saving money, and so doing things more cheaply is something we're interested in.  I'm secure that he finds me attractive, and has no issues with my weight or appearance, or even how I dress.  We accept each other for who we are.  On the other hand, it's a little uncertain what we both want from the relationship.  We're content, and plan to be together for the foreseeable future, but it's unclear who might want to get married, and whether kids might be a discussion.  I'm not even sure if I want kids.  He's older by 13 years and I have a rocky past that means I'm not as far along in my life or career as I want to be, my life is in flux.  So it's uncertain whether he's going to get frustrated with this, or if I'll be able to advance fast enough to make him feel like it's a real partnership, and whether moving in together and committing fully is something that we'd be able to make work.  It's also a little uncertain if we're together because it's easy, or because we're the best fit.",111,2,4,4,4,6,5.19
"My relationship is currently rocky. My boyfriend doesn't seem to understand my needs and instead, only takes care of his own needs. I don't like that. It makes me feel bad. I love him so much, but I am not certain about it. I feel like it's not going to work out in the long run. He's mean to me at times, and screams at me for no reason. I always feel like I'm not good enough. However, at times we have wonderful days.  For example, we take a lot of trips together, and I've experienced a lot of things with him. We have traveled the world, with so many happy and fun memories. We make each other feel good during those moments, and at those points, I feel like things are certain between us. But once things go back to the way they were, I feel sad again. I start to feel like those happy times don't outweigh the bad times.  My goals for the future would be to go to therapy together and work things out with one another. I would like for us to live happily ever after, but there is going to be a lot that needs to happen before we get there. I would like for us to work together for a common goal on how to make each other happy. It should not just be all about me making him happy or taking care of his needs, but he also needs to learn how to take care of mine as well. It's not an easy thing, and it hurts me a lot.",119,1.5,3,3,3,5,5
"I'm in a married relationship. I'm certain that our current and foremost issue is money. I'm a University dropout who earns little money by freelancing. My wife was working in a Multi national company but currently she is a full time mom taking care of our 1 year old son. I struggle a lot to make money for our everyday expenses and so we are living with my parents (Both my mom and dad are employed). We depend on my parents financially and my wife is very uncomfortable about it. I know this but couldn't help.  To talk about uncertain issues. We were dating since high school and broke up for 2 years primarily because of fights arising out of my employment issues. Then we re-united and married. Still now I have doubt that my wife might get a divorce from me because of my financial status. Together we don't have any savings, assets or jewellery. To be short we are penniless and we are very scared of school fees in our country which is a huge amount (almost my 3 months salary) and uncertain about how we are gonna send our son for schooling. Everyday we have silly fights over financial issues and I'm afraid anytime it would grow monstrous breaking our marriage bond.",55,1.5,3,4,3,6,4.19
"I'm certain about how much my husband loves me and is committed to me in our relationship. I can tell my husband loves me because he always did and does a lot for us. He saved me when we first got together because I was not having good luck in dating and I was terribly sad all the time. He changed that by being there for me, always following through, and doing manly things that take commitment to get done. For example, he fixed the plumbing in our house, which required him to get into cramped, uncomfortable positions. He also does all the dirty work so that I don't have to be uncomfortable. He never goes out with friends or anything. He is always with me, and I love that. I am uncertain about how much sex had to do with why my husband married me. I am also uncertain in how he compares me to other relationships from his past. Our sex life is important to us but we were intimate early on, and I think this is why he got hooked onto me. He never discusses past relationships so I can't gauge how he feels about them. That is probably a good thing, though.",22,3.5,4,4,5,6,5.81
"In my relationship I am certain of the following items. I am certain that my partner feels them same about me as I feel about her. I am also certain that we have the same religious beliefs that make a foundation for our relationship with each other and our families. Another certainty I have is how we feel about our future together. I have two children from a previous marriage and she has none. She is great with the kids and both of us agree that we would love to have more kids together. We are both certain of our career goals and how they match up with our family structure. Both of us strongly believe that our jobs and careers are important, but making time for our family is of the utmost importance to us.  There are a couple minor things that I am not certain of as this moment. My fiancé and I both love to fly fish and right now it is a big part of our lives. Escaping to the mountains and spending the weekend fishing in trout streams is a favorite to both of us. I'm not sure that when we add to our family and have new babies if that will continue with both of us or if that time and hobby will be a thing of the past that will be replaced by additional time with small children. We also have a fifteen year age gap between us where I am the older of us. I am not certain later on when I age how she will continue to feel about me romantically. With that age gap down the road things could chance between us and how we view each other.",129,3.5,5,4,5,6,5.81
"I'am certain about our feelings toward each other during these times, we are pretty confident in ourselves we just want the same goals and want the same things in life. For the most part we are on par with what we want with our goals. We both try to save our money for the future and try to do things to better our relationship. I'm just not sure about my partner because she likes to live in the now and the not the future. She likes to spend her money on expensive things in life and not really worry about the future sometimes and gets carried away with that kind of life which makes me feel uncertain. Sometimes it's hard to get her to look at the bigger picture in life and really notice what is important in life and material things don't and shouldn't matter much. She is starting to get it now so its becoming a bit better for our relationship and the mental health of our relationship. We want to buy a house and know that we have to save and really cant waste a dollar on anything that's not worth it. Slowly but surely we will get where we need to be.",20,2.5,4,4,4,5,5.38
"In my relationship there are many things that I am certain about along with a few that I am not as certain about. As far as the big picture goes and where our relationship is going, I believe that we are both on the same page. We are interested in moving forward and taking the next steps when appropriate. Our feelings are also something that I am certain about. I know how we both feel about each other. The things that we want in life are similar as well. After being together for this amount of time, I know that we are both growing together in similar ways. We enjoy each other's company and like to do things together. Things that I'm not as certain about tend to be the smaller things in the relationship like things that she likes and dislikes when I give her a gift. She is always so thankful that sometimes I don't know if she is being totally honest or just telling me what she thinks that I want to hear. Another thing I am uncertain about is her timetable. I know that our relationship is moving forward in a good way, but sometimes I think it's not moving fast enough for her.",33,4,4.5,5,4,5,4.94
"I am very certain about how my partner and I feel about each other. We really sincerely care about each other and do what we can to make each other happy. We give up our goals for each other and we do whatever we can to make sure that we each have a good day. We each want to help each other achieve our goals and we do whatever we can do to make that happen. At the same time, we have uncertainties in our relationship just like everyone else. Right now the biggest issue is money and where our relationship is going to go. We are married and we have no plans to divorce and our relationship is strong but he wants children and I don't. I don't know if this is something that I will change my mind on but he said that he'll wait and work through it together. So it's very uncertain for me to try to figure out whether or not we will ever have children, especially with our money issues. One thing that is for certain, though, is that we have plans to figure it out together and so I am not too concerned. I really love my partner and I am certain that we still stay together in the future. We are both extremely loyal people and we have both invested a lot in this relationship that we would lose if this marriage came to an end, so I don't think that we will ever divorce, but having kids is a big uncertainty. Overall, I am certain that our relationship is stable and we will be able to work through any problem we have because our relationship really is close to my ideal and I love him very much.",132,3.5,5,5,5,5,5.56
We've been together for 18 months. I'm certain of many things. We are best friends. We dont do battle. Its not that sort of relationship. We have each others backs. Im  certain she loves me and I am certain I love her. Our relationship keeps moving forward. I am uncertain if we are going to be married someday. Only because neither of us seem to want it very much. We're content.  We are committed to our shared goals. One goal is wealth building and not being stupid with our money as we both were in the past. Im certain we dont want any kids(she has two). I feel like we are very open with each other. I know her mind. Her worries and what makes her laugh.  Im certain of our relationships with each others families and friends. Her friends are now my friends and vice versa. Im certain things are going very well now. Probably because we take care of our money situation and have no small kids-both of which add a lot of stress to a relationship.  Im certain I am in a loving relationship where we take care of one another emotionally and sexually and we communicate well also.,15,5.5,4,4,5,6,5.5
